Company, Software, On-demand scan, On-access scan, Boot-time scans, Heuristics, CloudAV, Firewall, IDS, IPS, Sandbox, Email Security, AntiSpam, Web protection, Macro protection, Live Update, Support, Settings Import/ Export, installer/ updater MIMA safe, License, Price, First release, Country of origin, Original author/s, Notes
 AhnLab, AhnLab V3 Internet Security, {{Yes}}, {{Yes}}, {{Yes}}, {{Yes}}, {{Yes}}, {{Yes}}, {{Yes}}, {{Yes}}, ?, {{Yes}}, {{No}}, {{Yes}}, {{Yes}}, {{Yes}}, {{Yes}}, ?, ?, {{Proprietary}}, {{Nonfree}}, 1988, South Korea, Dr. Ahn Cheol-Soo, 
 Avast, Avast Free Antivirus, {{Yes}}, {{Yes}}, {{Yes}}, {{Yes}}, {{Yes}}, {{No}}, {{Yes}}, {{No}}, {{No}}, {{Yes}}, {{No}}, {{Yes}}, {{Yes}}, {{Yes}}, {{Yes}}, {{No}}, ?, {{Proprietary}}, {{Free}}, 1988, Czech Republic, Pavel Baudiš and Eduard Ku?era, 
 Avast, Avast Premium Security, {{Yes}}, {{Yes}}, {{Yes}}, {{Yes}}, {{Yes}}, {{Yes}}, {{Yes}}, {{No}}, {{Yes}}, {{Yes}}, {{Yes}}, {{Yes}}, {{Yes}}, {{Yes}}, {{Yes}}, {{No}}, ?, {{Proprietary}}, {{some|Trialware}}, 1997, Czech Republic, Pavel Baudiš and Eduard Ku?era, 
 AVG Technologies (avast), AVG Antivirus FREE, {{Yes}}, {{Yes}}, {{Yes}}, {{Yes}}, {{No}}, {{No}}, {{No}}, {{No}}, ?, {{No}}, {{No}}, {{Yes}}, {{Yes}}, {{Yes}}, {{Yes}}, {{No}}, ?, {{Proprietary}}, {{Free}}, 1992, Czech Republic, Jan Gritzbach and Tomáš Hofer, 
 AVG Technologies (avast), AVG Antivirus, {{Yes}}, {{Yes}}, {{Yes}}, {{Yes}}, {{Yes}}, {{No}}, {{No}}, {{No}}, ?, {{Yes}}, {{No}}, {{Yes}}, {{Yes}}, {{Yes}}, {{Yes}}, {{No}}, ?, {{Proprietary}}, {{Nonfree}}, 2006, Czech Republic, Jan Gritzbach and Tomáš Hofer, 
 AVG Technologies (avast), AVG Internet Security, {{Yes}}, {{Yes}}, {{Yes}}, {{Yes}}, {{Yes}}, {{Yes}}, {{Yes}}, {{Yes}}, ?, {{Yes}}, {{Yes}}, {{Yes}}, {{Yes}}, {{Yes}}, {{Yes}}, {{No}}, ?, {{Proprietary}}, {{Nonfree}}, 2008, Czech Republic, Jan Gritzbach and Tomáš Hofer, 
 Avira, Avira Antivirus FREE (formerly AntiVir), {{Yes}}, {{Yes}}, {{Yes}}, {{Yes}}, {{Yes}}, {{No}}, {{No}}, {{No}}, ?, {{No}}, {{Yes}}, {{No}}, {{Yes}}, {{Yes}}, {{Yes}}, ?, ?, {{Proprietary}}, {{Free}}, 1988, Germany, Tjark Auerbach, 
 Avira, Avira Internet Security, {{Yes}}, {{Yes}}, {{Yes}}, {{Yes}}, {{Yes}}, {{No}}, {{No}}, {{No}}, ?, {{Yes}}, {{Yes}}, {{Yes}}, {{Yes}}, {{Yes}}, {{Yes}}, ?, ?, {{Proprietary}}, {{Nonfree}}, 2002, Germany, Tjark Auerbach, 
 Bitdefender, Bitdefender Antivirus Free, {{Yes}}, {{Yes}}, {{Yes}}, {{Yes}}, {{Yes}}, {{No}}, {{No}}, {{No}}, {{No}}, {{No}}, {{No}}, {{Yes}}, {{No}}, {{Yes}}, {{Yes}}, ?, ?, {{Proprietary}}, {{Free}}, 2013, Romania, , 
 Bitdefender, Bitdefender Antivirus Plus, {{Yes}}, {{Yes}}, {{Yes}}, {{Yes}}, {{Yes}}, {{Yes}}, {{v}}, {{Yes}}, {{No}}, {{Yes}}, {{Yes}}, {{Yes}}, {{Yes}}, {{Yes}}, {{Yes}}, ?, ?, {{Proprietary}}, {{Nonfree}}, 1996, Romania, , 
 Bitdefender, Bitdefender Internet Security, {{Yes}}, {{Yes}}, {{Yes}}, {{Yes}}, {{Yes}}, {{Yes}}, {{Yes}}, {{Yes}}, {{No}}, {{Yes}}, {{Yes}}, {{Yes}}, {{Yes}}, {{Yes}}, {{Yes}}, ?, {{No}}[1], {{Proprietary}}, {{Nonfree}}, 2008, Romania, , 
 Check Point, ZoneAlarm PRO Antivirus + Firewall, {{Yes}}, {{Yes}}, {{No}}, {{Yes}}, {{No}}, {{Yes}}, {{No}}, {{No}}, ?, {{No}}, {{No}}, {{No}}, {{Yes}}, {{Yes}}, {{Yes}}, {{Yes}}, ?, {{Proprietary}}, {{Nonfree}}, 2002, Israel, , Third-party antivirus engine (Kaspersky) [2]
 Check Point, ZoneAlarm Extreme Security, {{Yes}}, {{Yes}}, {{No}}, {{Yes}}, {{Yes}}, {{Yes}}, {{No}}, {{No}}, ?, {{Yes}}, {{Yes}}, {{Yes}}, {{Yes}}, {{Yes}}, {{Yes}}, {{Yes}}, ?, {{Proprietary}}, {{Nonfree}}, 2002, United States, , 
 Cisco (originally Immunet), Immunet, {{Yes}}, {{Yes}}, {{No}}, {{No}}, {{Yes}}, {{No}}, {{No}}, {{No}}, ?, {{Yes}}, {{No}}, {{No}}, {{No}}, {{Yes}}, {{Yes}}, ?, ?, {{Proprietary}}, {{Free}}, 2010, United States, , Third-party antivirus engine (ClamAV)
 ClamWin, ClamWin, {{Yes}}, {{Yes}} (with Winpooch or Clam Sentinel), {{Yes}} (with Clam Sentinel), {{Yes}}, {{No}}, {{No}}, {{No}}, {{No}}, ?, {{Yes}}, {{No}}, {{No}}, {{No}}, {{Yes}}, {{No}}, ?, ?, {{GPL-lic}}, {{Free}}, 2002, Australia, , Third-party antivirus engine (ClamAV)
 Comodo Group, Comodo Antivirus, {{Yes}}, {{Yes}}, {{Yes}}, {{Yes}}, {{Yes}}, {{No}}, {{Yes}}, {{Yes}}, {{Yes}}, {{Yes}}*, {{Yes}}, {{Yes}}, {{Yes}}*, {{Yes}}, {{Yes}}, {{Yes}}, ?, {{Proprietary}}, {{Free}}, 2008, United States, , Protection via containment of untrusted executable code
 Comodo Group, Comodo Cloud Antivirus, {{Yes}}, {{Yes}}, {{Yes}}, {{Yes}}, {{Yes}}, {{No}}, {{Yes}}, {{Yes}}, {{Yes}}, {{Yes}}*, {{Yes}}, {{Yes}}, {{Yes}}*, {{Yes}}, {{Yes}}, {{Yes}}, ?, {{Proprietary}}, {{Free}}, 2016, United States, , Protection via containment of untrusted executable code
 Comodo Group, Comodo Internet Security, {{Yes}}, {{Yes}}, {{Yes}}, {{Yes}}, {{Yes}}, {{Yes}}, {{Yes}}, {{Yes}}, {{Yes}}, {{Yes}}*, {{Yes}}, {{Yes}}, {{Yes}}*, {{Yes}}, {{Yes}}, {{Yes}}, ?, {{Proprietary}}, {{Free}}, 2010, United States, , Protection via containment of untrusted executable code
 Dr.Web, Dr.Web Anti-virus, {{Yes}}, {{Yes}}, {{Yes}}, {{Yes}}, {{Yes}}, {{Yes}}, {{Yes}}, {{Yes}}, {{No}}, {{No}}, {{No}}, {{Yes}}*, {{Yes}}, {{Yes}}, {{Yes}}, {{Yes}}, {{Yes}}, {{Proprietary}}, {{some|Trialware}}, 1992, Russia, Igor Danilov, macOS/Linux feature only
 Dr.Web, Dr.Web Security Space, {{Yes}}, {{Yes}}, {{Yes}}, {{Yes}}, {{Yes}}, {{Yes}}, {{Yes}}, {{Yes}}, {{No}}, {{Yes}}, {{Yes}}, {{Yes}}, {{Yes}}, {{Yes}}, {{Yes}}, {{Yes}}, {{Yes}}, {{Proprietary}}, {{some|Trialware}}, 2006, Russia, Igor Danilov, 
 ESET, ESET NOD32 Antivirus, {{Yes}}, {{Yes}}, {{Yes}}, {{Yes}}, {{Yes}}, {{No}}, {{No}}, {{No}}, ?, {{Yes}}, {{No}}, {{Yes}}[3][4], {{Yes}}, {{Yes}}, {{Yes}}, {{Yes}}, ?, {{Proprietary}}, {{some|Trialware[5]}}, 1987, Slovakia, Peter Paško and Miroslav Trnka, 
 ESET, ESET Smart Security, {{Yes}}, {{Yes}}, {{Yes}}, {{Yes}}, {{Yes}}, {{Yes}}, {{Yes}}, {{Yes}}, ?, {{Yes}}, {{Yes}}, {{Yes}}[3][4], {{Yes}}, {{Yes}}, {{Yes}}, {{Yes}}, {{No}}[1], {{Proprietary}}, {{some|Trialware[5]}}, 2007, Slovakia, Peter Paško and Miroslav Trnka, 
 F-Secure, F-Secure Antivirus, {{Yes}}, {{Yes}}, {{Yes}}, {{Yes}}, {{No}}, {{No}}, {{No}}, {{No}}, ?, {{Yes}}, {{No}}, {{No}}, {{Yes}}, {{Yes}}, {{Yes}}, ?, ?, {{Proprietary}}, {{Nonfree}}, 1991, Finland, Petri Allas and Risto Siilasmaa, Third-party antivirus engine (Bitdefender)
 F-Secure, F-Secure SAFE, {{Yes}}, {{Yes}}, {{Yes}}, {{Yes}}, {{Yes}}, {{Yes}}, {{Yes}}, {{Yes}}, ?, {{Yes}}, {{Yes}}, {{Yes}}, {{Yes}}, {{Yes}}, {{Yes}}, ?, ?, {{Proprietary}}, {{Nonfree}}, 2004, Finland, Petri Allas and Risto Siilasmaa, Third-party antivirus engine (Bitdefender)
 FRISK Software, F-PROT Antivirus, {{Yes}}, {{Yes}}, {{Yes}}, {{Yes}}, {{No}}, {{No}}, {{No}}, {{No}}, ?, {{Yes}}, {{No}}, {{No}}, {{Yes}}, {{Yes}}, {{Yes}}, ?, ?, {{Proprietary}}, {{some|Trialware}}, 1989, Iceland, Friðrik Skúlason (second engine also with Dr. Vesselin Bontchev), 
 Fortinet, FortiClient, {{Yes}}, {{Yes}}, {{Yes}}, {{No}}, {{No}}, {{Yes}}, {{No}}, {{No}}, ?, {{No}}, {{No}}, {{Yes}}, {{No}}, {{Yes}}, {{Yes}}, ?, ?, {{Proprietary}}, {{Free}}, 2004, United States, , 
 G Data Software, G DATA AntiVirus, {{Yes}}, {{Yes}}, {{Yes}}, {{Yes}}, {{No}}, {{No}}, {{No}}, {{No}}, ?, {{No}}, {{No}}, {{Yes}}, {{Yes}}, {{Yes}}, {{Yes}}, ?, ?, {{Proprietary}}, {{Nonfree}}, 1987, Germany, Andreas Lüning and Kai Figge, Third-party antivirus engine (Bitdefender)
 G Data Software, G DATA InternetSecurity, {{Yes}}, {{Yes}}, {{Yes}}, {{Yes}}, {{Yes}}, {{Yes}}, {{Yes}}, {{No}}, ?, {{Yes}}, {{Yes}}, {{Yes}}, {{Yes}}, {{Yes}}, {{Yes}}, ?, ?, {{Proprietary}}, {{Nonfree}}, 2004, Germany, Andreas Lüning and Kai Figge, Third-party antivirus engine (Bitdefender)
 Kaspersky Lab, Kaspersky Anti-Virus, {{Yes}}, {{Yes}}, {{Yes}}, {{Yes}}, {{No}}, {{No}}, {{No}}, {{No}}, ?, {{Yes}}, {{No}}, {{Yes}}, {{No}}, {{Yes}}, {{Yes}}, ?, ?, {{Proprietary}}, {{Nonfree}}, 1997, Russia, Eugene Kaspersky and Natalia Kaspersky, Banned by USG
 Kaspersky Lab, Kaspersky Internet Security, {{Yes}}, {{Yes}}, {{Yes}}, {{Yes}}, {{Yes}}, {{Yes}}, {{Yes}}, {{Yes}}, ?, {{Yes}}, {{Yes}}, {{Yes}}, {{Yes}}, {{Yes}}, {{Yes}}, ?, ?, {{Proprietary}}, {{Nonfree}}, 2007, Russia, Eugene Kaspersky and Natalia Kaspersky, Banned by USG
 Kasp