, Description, Creator, First public release date, Latest stable version, Latest Stable Release Date, List Price (USD), Software license
Ability Photopaint, Graphics editor with some advanced features, Ability Software, {{dts|2001|03}}, 4, , , {{proprietary}}
ACDSee, , , , 19, , {{nonfree|$59}}, {{proprietary}}
ACDSee Pro, , , , 9, , {{nonfree|$99}}, {{proprietary}}
ACDSee Ultimate, , , , 9, , {{nonfree|$149}}, {{proprietary}}
Acorn Image Editor, Image editor and graphics creator for macOS, Flying Meat Inc., {{dts|2007|09|10}}, 5.6.2, {{dts|2017|01|24}}, , {{proprietary}}
Adobe Fireworks*, Alternative to Photoshop targeted at web designers  discontinued after CS6, Macromedia, {{dts|1998}}, CS6 / 12.0, {{dts|2012|05|07}}, Discontinued, {{proprietary}}
Adobe Photoshop, Professional image editor and graphics creation tool, Adobe Systems, {{dts|1990|02|19}}, CC 2019 / 20.0.4.260, {{dts|2019|03|06}}, {{nonfree|$9.99/month}}, {{proprietary}}
Adobe Photoshop Elements, Raster graphics editor for entry-level photographers  image editors and hobbyists, , , 14.0, {{dts|2015|09|24}}, {{nonfree|$99}}, {{proprietary}}
Adobe Photoshop Lightroom, Photo editor, Adobe Systems, {{dts|2007|02|19}}, 8.2, {{dts|2019|02|07}}, {{nonfree|$9.99/month}}, {{proprietary}}
Affinity Photo, Professional image editor for Windows  macOS and iOS, Serif Europe, {{dts|2015|07|09}}, 1.6.7, {{dts|2018|03|01}}, {{nonfree|$49.99}}, {{proprietary}}
Autodesk SketchBook Pro, Paint and drawing toolset for use with digitized pen tablets & tablet computers, Autodesk, {{dts|2004}}, 2016 (4.1), , , {{proprietary}}
Artipic, Image editor for Windows and macOS, Artipic AB, {{dts|2014}}, 2.6, October 30  2017, , {{proprietary}}
ArtRage, Digital paint program for tablet computers, Ambient Design, {{dts|2004}}, 4.5.1, , , {{proprietary}}
Artweaver, Emulates physical painting experience on a computer, Boris Eyrich, {{dts|2002}}, 3.0, , , {{nonfree|Freeware}}
Bibble*, Photo editor and organizer with camera raw file support, Bibble Labs, {{dts|2000}}, 5.2, , , {{proprietary}}
Bloom Image Editor, Procedural node-based image editor, Sad Cat Software, {{dts|2015}}, 1.0.181, , , {{proprietary}}
Brush Strokes Image Editor, Image editor like Windows Paint, Paul Bird, {{dts|2004}}, 2.0, , , {{nonfree|Freeware}}
Capture One, Professional raw converter and image editor, Phase One, {{dts|2002}}, 12, , , {{proprietary}}
Chasys Draw IES, Image Editor with layers  animation  icon edit  super-res  batch and camera raw, John Paul Chacha, {{dts|2001}}, 4.56.01, November 12  2018, , {{nonfree|Freeware}}
CinePaint, Moving picture  photo and graphics editor, Robin Rowe, {{dts|2002|07|04}}, 2011 (1.0), , , {{free|GPL}}
CodedColor PhotoStudio Pro, An bitmap graphics editor and image organizer for Windows pc, 1STEIN Corp., {{dts|2001}}, 6.2, , , {{proprietary}}
Corel PaintShop Pro, Advanced image editor and graphics creator, Jasc Software, {{dts|1992}}, X7, , , {{proprietary}}
Corel Painter, Made to create natural-looking artistic images, Mark Zimmer  Tom Hedges  John Derry, {{dts|1991|08}}, 15.1.0.740, {{dts|2016|01|12}}, , {{proprietary}}
Corel PHOTO-PAINT, Professional image editor and graphics creator with advanced features, Corel Corporation, {{dts|1992}}, X7/17, , , {{proprietary}}
darktable, Photography workflow application and raw developer, Johannes Hanika, {{dts|2009|04}}, 2.0, , , {{free|GPL 3}}
Deluxe Paint*, Discontinued basic editor, Dan Silva, {{dts|1985}}, 5, , , {{proprietary}}
Deneba Canvas, Graphics editor and creator supporting both raster graphics and vector graphics.It also work on GIS data., Jorge Miranda  Joaquin de Soto  Manny Menendez, {{dts|1987|09}}, 14, , , {{proprietary}}
DigiKam, Free photo organizer and image editor, Renchi Raju  Gilles Caulier, {{dts|2002}}, 4.10.0, , , {{free|GPL}}
Digital Photo Professional, Photo organizer and image editor from Canon, Canon Inc., , 4.2.10, , , {{proprietary}}
Erdas Imagine, Advanced remote sensing and GIS ability; handles multispectral images, ERDAS  Inc., {{dts|1980}}, 2016 (16), {{dts|2016|06|14}}, , {{proprietary}}
Fatpaint, Full featured web-based graphic design and photo editing application, Mersica Inc., {{dts|2010}}, 1.99.55, , , {{nonfree|Freeware}}
Fotografix, Freeware  portable image editor, L. Madhavan, {{dts|2009|04|14}}, 1.5, , , {{nonfree|Freeware}}
F-Spot, Image viewer and organizer for GNOME, Ettore Perazzoli, {{dts|2005}}, 0.8.2, , , {{free|GPLv2}}
G'MIC, Free command line software for 2D or 3D image processing and visualization, David Tschumperlé, {{dts|2008|10}}, 1.7.9, , , {{free|CeCILL}}
GIMP, Free image editor and graphics creator, Spencer Kimball  Peter Mattis, {{dts|1996|01}}, 2.10.12, November 8  2018, , {{free|GNU (L)GPLv3+ v2.7+[3]}}
GimPhoto, Modification of the free and open-source graphics program GNU Image Manipulation Program (GIMP)  with the intent to be a free alternative to Adobe Photoshop., Ek Kian, , 1.4.3, , , {{free|GPLv2}}
GIMPshop, GIMP with a GUI similar to Adobe Photoshop, Scott Moschella, , 2.2.11, , , {{free|GPL}}
GNU Paint, Free and open-source raster graphics editor, Andy Tai, {{dts|2007|09|10}}, 0.3.3, , , {{free|GPL}}
GrafX2, GrafX2 with a GUI similar to Deluxe Paint, Sunset Design (Guillaume Dorme  Karl Maritaud), {{dts|1996}}, 2.5, {{dts|2018|05|19}}, , {{free|GPL}}
GraphicConverter, Image viewer  converter  organizer and editor capable of importing around 200 and exporting 80 different image file types. Compatible with many Photoshop plug-ins, Thorsten Lemke, {{dts|1992}}, 10, , , {{proprietary}}
GraphicsMagick, Commandline image converter and editor, GraphicsMagick Group, {{dts|2002}}, 1.3.21, , , {{free|MIT}}
gThumb, Image viewer and organizer for the GNOME desktop environment, Paolo Bacchilega, {{dts|2001}}, 3.4.0, , , {{free|GPL3}}
HDR PhotoStudio, HDR (High Dynamic Range Editor) with human vision imaging model, Unified Color, {{dts|2009|10}}, 2.15.37, , , {{proprietary}}
Helicon Filter, Advanced image editor with a simplified tabbed interface, Helicon Soft Ltd., {{dts|2004|08}}, 5.0.28, , , {{proprietary}}
ImageJ, Image processing program developed at the National Institutes of Health., Wayne Rasband (NIH), {{dts|1997}}, 1.46m, , , {{free|Public Domain}}
ImageMagick, Command line software suite for displaying  converting  and editing raster image files, ImageMagick Studio LLC, {{dts|1990}}, 6.7.7-7, , , {{free|Apache 2.0}}
iPhoto*, Image organizer and basic editor for macOS; replaced by Photos, Apple Inc., {{dts|2002}}, 9.6, , , {{proprietary}}
IrfanView, Image and video viewer with basic editing functions, Irfan Skiljan, {{dts|1996}}, 4.44[4], December 20  2016, , {{nonfree|Freeware}}
Iridient Developer, Powerful raw image conversion application designed and optimized for macOS, Iridient Digital, {{dts|2004}}, 3.0.3, , , {{proprietary}}
Kolourpaint, , KDE, {{dts|2004}}, 1.2.2, , , {{free|BSD}}
Krita, Digital painting oriented free and open-source raster graphic editor with vector support. KDE/Calligra based., KDE, {{dts|2005}}, 4.2.2, {{dts|2019|06|27}}, , {{free|GPL}}
LazPaint, Free multiplatform layered image editor, circular, {{dts|2011}}, 6.2, , , {{free|GPL}}
LiveQuartz, Basic multi-layer photo editor, Romain Piveteau, {{dts|2005}}, 2.8, December 1  2018, , {{proprietary}}
MacPaint*, Obsolete basic editor, Bill Atkinson, {{dts|1984}}, 2.0, , , {{proprietary}}
Microsoft Office Picture Manager*, Basic image editor, Microsoft, {{dts|2002}}, 14.0, , , {{proprietary}}
Microsoft Paint, Basic graphic creator and editor packaged with Microsoft Windows operating systems, Microsoft, {{dts|1985}}, 6.1, , , {{proprietary}}
Microsoft Photo Editor*, Obsolete basic image editor for Windows, Microsoft, {{dts|2000}}, 3.01, , , {{proprietary}}
mtPaint, pixel art and photo editing application, Mark Tyler, {{dts|2004|09|13}}, 3.40, , free, {{free|GPL3}}
MyPaint, Digital painting application, Martin Renold, {{dts|2005|03|12}}, 1.2.1, , free, {{free|GPL2}}
OpenCanvas, , Portalgraphics, {{dts|2000}}, 4, , , {{proprietary}}
paint.net, Freeware image editor and graphics creator based on the .Net framework, Rick Brewster  et al., {{dts|2004|05|06}}, 4.0.19 (for Windows 7 SP1 or newer) / 3.5.11 (the last version to support Windows XP), October 2  2017, , {{nonfree|Freeware}}[5][6]
Paint Tool SAI*, Simple and lightweight painting software, Systemax Software, {{dts|2008|02|25}}, 1.2.5, {{dts|2016|04|25}}, {{nonfree|~$50 (5500JPY)}}, {{proprietary}}
PC Paintbrush*, Obsolete basic editor, ZSoft Corporation, {{dts|1984}}, 5, , , {{proprietary}}
Pencil2D, 2D graphical animation software., Pascal Naidon, , 0.4.4, , , {{free|GPL}}
Phatch, Editor for batch processing digital graphics and photographs., Stani Michiels, , 0.2.7, , , {{free|GPL}}
Photogenics, Made to create 32-bit HDRs, Idruna Software Inc., {{dts|1995}}, HDR 7.0, , , {{proprietary}}
PhotoLine, Image editor with advanced features, Computerinsel (Germany), {{dts|1995}}, 20.53, 2018, €59, {{proprietary}}
PhotoPerfect*, Image editor with some advanced features, Arcadia Software AG  Joachim Koopmann Software, {{dts|2002}}, 2.9, , , {{proprietary}}
Photos, Image organizer and basic editor for macOS; replaced iPhoto from OS X 10.10.3 onwards, Apple Inc., {{dts|2014}}, 1.0, , , {{proprietary}}
Photo Raster, Advanced online photo editor, David Levinsky, {{dts|2012}}, 0.9, , , {{proprietary}}
Picasa*, Efficient image organizer with basic editing tools  other image effects, Google, {{dts|2002}}, 3.9.141.259, {{dts|2015|10|09}}, Discontinued, {{nonfree|Freeware}}
PicMaster, Has 300 filter effects  slide show  poster printing  mosaics  true 3D  more, Alexander Sabov, {{dts|1999|12}}, 4.03, , , {{proprietary}}
Pinta, Mid-level Free and Open Source raster graphics editor  based on Paint.Net, Jonathan Pobst, {{dts|2010|02|07}}, 1.5, , , {{free|MIT}}
PixBuilder Photo Editor, , WnSoft Graphic Software, {{dts|2005|06}}, 1.31, , , {{proprietary}}
Pixelmator, Image editor and graphics creator for macOS, Pixelmator Team ltd., {{dts|2007|09|25}}, 3.0, , , {{proprietary}}
Pixen, Pixel art and sprite editor for macOS, Open Sword Group, , 3.8, , , {{proprietary}}
Pixia, Originally designed for Anime/Manga art., Isao Maruoka, {{dts|1998}}, 4.70d, , , {{proprietary}}
PMview, Fast image viewer with basic editing functions, Peter Nielsen, {{dts|1992}}, 3.80 (2017), , , {{proprietary}}
Project Dogwaffle, Dan Ritchie retired but others continue active development[7], Dan Ritchie, {{dts|1997}}, 2011 (7.0) (1.2 available as freeware), , , {{proprietary}}
QFX, Mature and complete image editing package, Ron Scott, {{dts|1990}}, 8, , , {{proprietary}}
Rawstudio, Raw image processor., Anders Brander & Anders Kvist, {{dts|2006|06|22}}, 2.0, , , {{free|GPL 2}}
RawTherapee, Powerful free and cross-platform raw image editor  for developing raw photos from digital cameras., Gabor Horvath, {{dts|2006|09|21}}, 4.0.11, , , {{free|GPL}}
Seashore, Basic counterpart to GIMP  using its XCF format; full support for a few graphics formats, Mark Pazolli, {{dts|2003|01|16}}, 2.4.0, , , {{free|GPLv2}}
Serif PhotoPlus, Complete editor and photo organizer suite; similar features and menus to other software from Serif; available as economy version or in bundle with clipart  effects  public domain image library; made for easy use, Serif, {{dts|1999}}, X8, {{dts|2015|08|10}}, , {{proprietary}}
Shotwell, Image organizer for GNOME, Yorba Foundation, {{dts|2009|06|26}}, 0.12.3, , , {{free|LGPL 2.1}}
Tux Paint, Drawing program for young children., Bill Kendrick, {{dts|2002|06|16}}, 0.9.21, , , {{free|GPL}}
TVPaint, 2D animation software, Herve ADAM, {{dts|1991|06|16}}, 9.5.11, , , {{proprietary}}
UFRaw, Raw image format processor, Udi Fuchs, , 0.22, , , {{free|GPL}}
Ulead PhotoImpact*, , Ulead Systems, , 12, , , {{proprietary}}
Ultimate Paint*, Basic graphics editor based on Deluxe Paint, Joseph Ladanyi  Daniel Szabo, {{dts|1998}}, 2.88, , , {{proprietary}}
WinImages, Animation-centric, Black Belt Systems, {{dts|1985}}, 7.5, , , {{proprietary}}
Xara Photo & Graphic Designer, Graphic design program including photo editing and vector illustration tools, Xara, {{dts|1995}} (Windows), 9, , , {{proprietary}}
XnView, Cross-platform image viewer used for converting  organising and editing graphical & video files., Pierre-emmanuel Gougelet, {{dts|1998}} (1.06), 2.20 (Windows)/0.64 (Linux  macOS), , , {{proprietary}}
XPaint, Simple Drawing program for Unix/X11 with Xaw3d widgets, David Koblas  Torsten Martinsen  Jean-Pierre Demailly, {{dts|1993}}, 2.9.10.3, , , {{free|Custom free license}}
Zoner Photo Studio, All-in-one editor package, Zoner Inc., , 11.0 build 8, , , {{proprietary}}
