Distribution, Founder, Maintainer, Initial release year, Current stable version, Security updates (years), Release date, System distribution commitment, Forked from, Target audience, Cost, Status
 Alpine Linux, Alpine Linux Team, Alpine Linux Team, {{date|2006|iso}}, 3.10[2], {{dunno}}, {{date|2019-06-13|iso}}, {{Proprietary|X}}, LEAF Project, security  lightweight  general, {{Free|Gratis}}, {{site active}}
 ALT Linux, ALT Linux Team, ALT Linux Team  ALT Linux LLC, {{date|2001|iso}}, 8.2[3], {{dunno}}, {{date|2013-07-10|iso}}, {{Proprietary|X}}, Mandrake Linux, general  school, {{Free|Gratis}}, {{site active}}
 antiX, Anticapitalista, Anticapitalista, {{date|2007|iso}}, 17.4.1[4], {{dunno}}, {{date|2017-08-24|iso}}, {{Proprietary|X}}, Debian  MEPIS, old computers, {{Partial|Some editions are gratis}}, {{site active}}
 ArchBang, Willensky Aristide, Stan McLaren, {{date|2010|iso}}, Rolling, Rolling, {{dunno}}, {{Proprietary|X}}, Arch Linux, general, {{Free|Gratis}}, {{site active}}
 Arch Linux, Judd Vinet, dev team, {{date|2002|iso}}, Rolling, Rolling, Rolling, {{Proprietary|X}}, Independent  inspired from CRUX, general, {{Free|Gratis}}, {{site active}}
 BLAG, Brixton Linux Action Group, Brixton Linux Action Group, {{date|2002|iso}}, 140k, {{dunno}}, {{date|2011-05-04|iso}}, {{Free|100% Free: GNU FSDG}}, Fedora, desktop, {{Free|Gratis}}, {{site inactive}}
 Bodhi Linux, Bodhi Linux Team, Bodhi Linux Team, {{date|2011|iso}}, 5.0.0[5], {{dunno}}, {{date|2018-08-22|iso}}, {{Proprietary|X}}, Debian  Ubuntu, desktop  lightweight, {{Free|Gratis}}, {{site active}}
 Canaima, CANTV / CNTI / CENTIDEL / Edelca / VIT / FUNDACITE / Free software community, CANTV / CNTI / CENTIDEL / Edelca / VIT / FUNDACITE / Free software community, {{date|2007|iso}}, 6.0[6], {{dunno}}, {{date|2018-03-19|iso}}, {{Proprietary|X}}, Debian  Ubuntu, Government of Venezuela, {{Free|Gratis}}, {{site active}}
 CentOS, CentOS Project, CentOS Project, {{date|2003|iso}}, 7.7-1909, 10 years[7], {{date|2019-09-17|iso}}, {{Proprietary|X}}, Red Hat Enterprise Linux (RHEL), server  workstation, {{Free|Gratis}}, {{site active}}
 Chakra, Jan Mette and Arch Linux KDEmod developers, The Chakra Project Team, {{date|2010|iso}}, Rolling, Rolling, {{dunno}}, {{Proprietary|X}}, Arch Linux[8], desktop, {{Free|Gratis}}, {{site active}}
 Chrome OS, Sundar Pichai, Google, 2009, 75.0.3770.129[9], 6.5 years[10], 2019-07-09, {{Proprietary|X}}, Chromium OS, web applications, {{Free|Gratis}}, {{site active}}
 ClearOS, Peter Baldwin, ClearFoundation, {{date|2000|iso}}, 7.6.0[11], {{dunno}}, {{date|2019-05-09|iso}}, {{Proprietary|X}}, RHEL  CentOS, server  gateway  network, {{Partial|Some editions are gratis}}, {{site active}}
 CrunchBang Linux, Philip Newborough, Philip Newborough, {{date|2008|iso}}, 11[12], {{dunno}}, {{date|2013-05-06|iso}}, {{Proprietary|X}}, Debian, desktop, {{Free|Gratis}}, {{site inactive}}
 Damn Small Linux, John Andrews, dev team, {{date|2003|iso}}, 4.4.10[13], {{dunno}}, {{date|2008-11-18|iso}}, {{Proprietary|X}}, Debian  Knoppix, lightweight  portable, {{Free|Gratis}}, {{site active}}
 Debian, Ian Murdock, Debian Project, {{date|1993|iso}}, 10.1[14], ~3 years[15], {{date|2019-09-07|iso}}, {{Free|Debian Social Contract and DFSG}} (main is 100% free  non-free packages are optional)[16], Softlanding Linux System (SLS)[17], general  server  desktop, {{Free|Gratis}}, {{site active}}
 Debian Edu, , Debian Project, {{date|2004|iso}}, 9.0+edu0[18], ~3 years[15], {{date|2017-06-18|iso}}, {{Partial|Debian Social Contract and DFSG}}, Debian, schools, {{Free|Gratis}}, {{site active}}
 Devuan, The "Veteran Unix Admins" (VUA), The "Veteran Unix Admins" (VUA), {{date|2016|iso}}, 2.0.0[19], {{dunno}}, {{date|2018-09-16|iso}}, {{Proprietary|X}} [20], Debian, general, {{Free|Gratis}}, {{site active}}
 Deepin, Wuhan Deepin Technology Co.  Ltd., Wuhan Deepin Technology Co.  Ltd., {{date|2004|iso}}, 15.10.2[21], {{dunno}}, {{date|2019-07-05|iso}}, {{dunno}}, Debian(unstable branch)  Ubuntu  Morphix, general, {{Free|Gratis}}, {{site active}}
 Dragora GNU/Linux-Libre, Matias A. Fonzo, Matias A. Fonzo, {{date|2009|iso}}, 3.0-alpha2[22], {{dunno}}, {{date|2018-09-28|iso}}, {{Free|100% Free: GNU FSDG}}, Independent  inspired from Slackware, general, {{Free|Gratis}}, {{site active}}
 dyne:bolic, Jaromil, Jaromilx, {{date|2005|iso}}, 3.0.0, {{dunno}}, {{date|2011-09-08|iso}}, {{Free|100% Free: GNU FSDG}}, Debian, multimedia, {{Free|Gratis}}, {{site inactive}}
 Elementary OS, Daniel Foré, elementary LLC, {{date|2011|iso}}, 5.0[23], {{dunno}}, {{date|2018-10-16|iso}}, {{Proprietary|X}}, Ubuntu  Debian, general, {{Free|Gratis}}, {{site active}}
 ELinOS, SYSGO, SYSGO, {{date|1999|iso}}, 6.2[24], {{dunno}}, {{date|2017-10-01|iso}}, {{Proprietary|X}}, –, embedded systems, {{partial}}, {{site active}}
 Emdebian Grip, Embedded Debian Project, Embedded Debian Project, {{date|2009|iso}}, 3.1, End-of-life, {{date|2013-06-15|iso}}, {{Proprietary|X}}, Debian, embedded systems, {{Free|Gratis}}, {{site inactive}}
 EndeavourOS, Bryan Poerwoatmodjo, EndeavourOS, {{date|2019|iso}}, Rolling, Rolling, 2019-07-15, {{Proprietary|X}}, Arch Linux, general, {{Free|Gratis}}, {{site active}}
 Fedora, Fedora Project, Fedora Project, {{date|2003|iso}}, 30[25], 1 year, {{date|2019-04-29|iso}}, {{Partial|Fedora Licensing Guidelines}}[26], Red Hat Linux, general, {{Free|Gratis}}, {{site active}}
 Freespire, Lindows.com  Inc., PC/OpenSystems LLC, {{date|2001|iso}}, 4.8[27], {{dunno}}, {{date|2018-12-20|iso}}, {{Proprietary|X}}, Ubuntu, desktop, {{Free|Gratis}}, {{site active}}
 Gentoo Linux, Daniel Robbins, Gentoo Foundation  Inc., {{date|2002|iso}}, Rolling, Rolling, Rolling, {{Partial|Gentoo Social Contract}}, Enoch Linux, general, {{Free|Gratis}}, {{site active}}
 Guix, Ludovic Courtès, Ludovic Courtès  Ricardo Wurmus  the Guix community, {{date|2012|iso}}, 1.0.1[28], Rolling, {{date|2019-05-02|iso}}, {{Free|100% Free: GNU FSDG}}, –, general, {{Free|Gratis}}, {{site active}}
 gNewSense, Brian Brazil and Paul O'Malley, Sam Geeraerts with sponsorship from the FSF, {{date|2006|iso}}, 4.0 (Ucclia)[29], {{dunno}}, {{date|2016-05-02|iso}}, {{Free|100% Free: GNU FSDG}}, Debian, general  server, {{Free|Gratis}}, {{site active}}
 gnuLinEx, Regional Government of Extremadura, dev team, {{date|2002|iso}}, LinEx 2013, {{dunno}}, {{date|2013-02-11|iso}}, {{Proprietary|X}}, Debian, desktop, {{Free|Gratis}}, {{site inactive}}
 Grml, Michael Prokop, The Grml Team, {{date|2005|iso}}, 2018.12[30], {{dunno}}, {{date|2018-12-31|iso}}, {{Proprietary|X}}, Debian, live  maintenance  security  network  forensic  accessibility, {{Free|Gratis}}, {{site active}}
 Hyperbola GNU/Linux-libre, Hyperbola Founders, Hyperbola Founders, {{date|2017|iso}}, 0.3[31], 3 years (stable)  5 years (old stable)[32], {{date|2019-09-23|iso}}, {{free|100% Free: GNU FSDG followed in Hyperbola Social Contract}}, Arch Linux, general, {{free|Gratis}}, {{site active}}
 Instant WebKiosk, Marco Buratto, Binary Emotions, {{date|2012|iso}}, 16.0[33], {{dunno}}, {{date|2017-04-05|iso}}, {{Proprietary|X}}, Debian, web kiosks  digital signage  personal web navigation, {{free|Gratis}}, {{site active}}
 Kali Linux, Max Moser  Mati Aharoni  Martin J. Muench, Offensive Security, {{date|2013|iso}}, 2019.2[34], {{dunno}}, {{date|2019-05-21|iso}}, {{Proprietary|X}}, Debian, auditing  forensic  security  network, {{Free|Gratis}}, {{site active}}
 Knoppix, Klaus Knopper, dev team, {{date|2000|iso}}, 8.6[35], {{dunno}}, {{date|2019-08-08|iso}}, {{Proprietary|X}}, Debian, live, {{Free|Gratis}}, {{site active}}
 Kodibuntu, The XBMC Project, Team Kodi, {{date|2008|iso}}, {{dunno}}, {{dunno}}, {{dunno}}, {{Proprietary|X}}, Debian  Ubuntu, multimedia, {{Free|Gratis}}, {{site inactive}}
 Korora, Chris Smart, Dev Team, {{date|2005|iso}}, 26[36], {{dunno}}, {{date|2017-09-16|iso}}, {{Proprietary|X}}, Fedora, desktop, {{Free|Gratis}}, {{site inactive}}
 LibreCMC, LibreCMC team, LibreCMC team, {{date|2010|iso}}, 1.4.8[37], {{dunno}}, {{date|2019-06-30|iso}}, {{Free|100% Free: GNU FSDG}}, Merged from LibreWRT, embedded systems, {{Free|Gratis}}, {{site active}}
 Linspire, Linspire  Inc., Linspire  Inc., {{Date|2001|iso}}, 7.0 SP1[38], {{dunno}}, {{date|2018-04-08|iso}}, {{Proprietary|X}}, Ubuntu, {{dunno}}, {{no|Commercial}}[39], {{site active}}
 Linux Mint, Clement Lefebvre, dev team, {{date|2006|iso}}, 19.2[40], ~3 years (LMDE); 5 years (main editions), {{date|2019-08-02|iso}}, {{Proprietary|X}}, Debian(LMDE)  Ubuntu (LTS versions), desktop, {{Free|Gratis}}, {{site active}}
 Linux Lite, Jerry Bezencon, Linux Lite Team, 2012, 4.4[41], {{dunno}}, 2018-11-01, {{Proprietary|X}}, Ubuntu, desktop, {{Free|Gratis}}, {{site active}}
 Mageia, Mageia Community, mageia.org, {{date|2010|iso}}, 7.1[42], 1 year, {{date|2019-07-01|iso}}, {{Proprietary|X}}, Mandriva Linux, general, {{Free|Gratis}}, {{site active}}
 Mandriva Linux, Mandrakesoft S.A., Mandriva S.A., {{date|1998|iso}}, 2011, {{dunno}}, {{date| 2011-08-28|iso}}, {{Proprietary|X}}, Red Hat Linux, general, {{Partial|Some editions are gratis}}, {{site inactive}}
 Manjaro Linux, Roland Singer, dev team, {{date|2012|iso}}[43], Rolling, Rolling, Rolling, {{Proprietary|X}}, Arch Linux, general, {{Free|Gratis}}, {{site active}}
 MEPIS, Warren Woodford, MEPIS LLC, {{date|2003|iso}}, 11.9.90, {{dunno}}, {{dunno}}, {{Proprietary|X}}, Debian, desktop  server, {{Free|Gratis}}, {{site inactive}}
 Musix GNU+Linux, Musix team, Musix team, {{date|2008|iso}}, 3.0.1, {{dunno}}, {{date|2014-03-13|iso}}, {{Free|100% Free: GNU FSDG}}, Debian, multimedia, {{Free|Gratis}}, {{site active}}
 Netrunner, Blue Systems, dev team, {{date|2009|iso}}, 2018.08[44], as per Debian Testing or Manjaro (rolling), {{date|2018-03-11|iso}}, {{Proprietary|X}}, Debian  Manjaro/Arch, desktop, {{Free|Gratis}}, {{site active}}
 NixOS, Eelco Dolstra and Armijn Hemel, NixOS Foundation, {{date|2003|iso}}, 19.03, 0.5 years, {{date|2019-05-02|iso}}, {{Proprietary|X}}, –, general  server  desktop, {{Free|Gratis}}, {{site active}}
 Novell Open Enterprise Server, Novell, Novell  Inc. dev team, {{date|2003|iso}}, OES 2018 SP1, {{dunno}}, {{dunno}}, {{Proprietary|X}}, SUSE Linux Enterprise Server, server, {{no|Commercial}}[45], {{site active}}
 OpenELEC, Stephan Raue  OpenELEC Team, OpenELEC Team, {{date|2011|iso}}, 8.0.4, {{dunno}}, {{date|2017-06-04|iso}}, {{Proprietary|X}}, Kodi, multimedia, {{Free|Gratis}}, {{site active}}
 openSUSE, SUSE Linux  Novell, openSUSE Project, {{date|2006|iso}}, Leap 15.1[46], 3 years[47], {{date|2019-05-22|iso}}, {{Proprietary|X}}, –, general  desktop, {{Free|Gratis}}, {{site active}}
 OpenWrt, {{dunno}}, OpenWrt team, {{date|2007|iso}}, 18.06.4[48], {{dunno}}, {{date|2019-07-01|iso}}, {{Proprietary|X}}, –, embedded systems, {{Free|Gratis}}, {{site active}}
 OpenMandriva Lx, OpenMandriva Association, OpenMandriva Association, {{date|2013|iso}}, 4.0, {{dunno}}, {{date|2019-05-12|iso}}, {{Free|100% Free: GNU FSDG}}, Mandriva Linux, general, {{Free|Gratis}}, {{site active}}
 Oracle Linux, Oracle Corporation, Oracle Corporation, {{date|2006|iso}}, 7.6[49], {{dunno}}, {{date|2018-11-07|iso}}, {{Proprietary|X}}, Red Hat Enterprise Linux (RHEL), server, {{Free|Gratis}}, {{site active}}
 Parabola GNU/Linux-libre, Parabola Hackers, Parabola Hackers, {{date|2009|iso}}, Rolling[50], Rolling, {{date|2017-05-28|iso}}, {{Free|100% Free: GNU FSDG followed in Parabola Social Contract}}, Arch Linux, general, {{Free|Gratis}}, {{site active}}
 Pardus, Scientific and Technological Research Council of Turkey (TÜB?TAK), TÜB?TAK, {{date|2005|iso}}, 17.5[51], {{dunno}}, {{date|2018-11-3|iso}}, {{Proprietary|X}}, Gentoo (2011.2) Debian, general, {{Free|Gratis}}, {{site active}}
 Parsix, Alan Baghumian, Parsix Project, {{date|2005|iso}}, 8.15, {{dunno}}, {{date|2017-01-25|iso}}, {{Proprietary|X}}, Debian, desktop, {{Free|Gratis}}, {{site inactive}}
 PCLinuxOS, Bill Reynolds, dev team, {{date|2003|iso}}, 2019.06[52], Semi-rolling, {{date|2019-06-16|iso}}, {{Proprietary|X}}, Mandriva Linux, desktop, {{Free|Gratis}}, {{Active}}
 Pop! OS, Carl Ritchell, System76, {{date|2017|iso}}, 19.10, {{dunno}}, {{date|2019-10-19|iso}}, {{Proprietary|X}}, Ubuntu, desktop  server  laptop, {{Free|Gratis}}, {{Active}}
 Pentoo, Michael Zanetta  Rick Farina  Jens Pranaitis, Pentoo, {{date|2005|iso}}, 2019.1, {{dunno}}, {{date|2019-01-17|iso}}, {{Proprietary|X}}, Gentoo Linux, auditing  security, {{free|Gratis}}, {{site active}}
 Porteus, Fanthom, Porteus, {{date|2010|iso}}, 4.0[53], {{dunno}}, {{date|2018-04-29|iso}}, {{Proprietary|X}}, Slackware, lightweight  portable, {{free|Gratis}}, {{site active}}
 Puppy Linux, Barry Kauler, Puppy Foundation, {{date|2003|iso}}, 8.0[54], {{dunno}}, {{date|2019-04-11|iso}}, {{Proprietary|X}}, Independent  inspired from Vector linux, lightweight  portable, {{Free|Gratis}}, {{site active}}
 Qubes OS, Joanna Rutkowska, Invisible Things Lab, {{date|2012|iso}}, 4.0.1[55], {{dunno}}, {{date|2019-01-09|iso}}, {{Proprietary|X}}, Xen and Fedora, security by compartmentalization  desktop, {{Free|Gratis}}, {{site active}}
 Red Hat Enterprise Linux (RHEL), Red Hat, Red Hat, {{date|2002|iso}}, 8.0, 10 years[56], {{date|2019-05-07|iso}}, {{Proprietary|X}}, Red Hat Linux  Fedora, server  workstation, {{no|Commercial}}[57][58], {{site active}}
 Red Hat Linux, Red Hat, Red Hat, {{date|1995|iso}}, 9, {{dunno}}, 2003-03-31, {{Proprietary|X}}, –, server  workstation, {{Free|Gratis}}, {{site inactive}}
 ROSA, {{dunno}}, LLC NTC IT ROSA, {{date|2011|iso}}, R11[59], {{dunno}}, 2019-03-15, {{Proprietary|X}}, Mandriva, server  general, {{Free|Gratis}}, {{site active}}
 Rocks Cluster Distribution, UCSD Supercomputing Center  Clustercorp, UCSD Supercomputing Center  Clustercorp, {{date|2000|iso}}, 7.0, {{dunno}}, 2015-12-01, {{Proprietary|X}}, Red Hat Linux, server  workstation, {{free|Gratis}}, {{site active}}
 Sabayon Linux, Fabio Erculiani, dev team, {{date|2005|iso}}, 19.03[60], {{dunno}}, 2019-03-31, {{Proprietary|X}}, Gentoo Linux, general, {{free|Gratis}}, {{site active}}
 Salix OS, Cyrille Pontvieux  George Vlahavas  Pierrick Le Brun  Thorsten Mühlfelder, Salix team, {{date|2009|iso}}, 14.2, {{dunno}}, {{date|2016-08-29|iso}}, {{Proprietary|X}}, Slackware, general, {{free|Gratis}}, {{dunno}}
 Scientific Linux, CERN  Fermilab, dev team, {{date|2004|iso}}, 7.6[61], {{dunno}}, 2018-12-03, {{Proprietary|X}}, Red Hat Linux  Red Hat Enterprise Linux (RHEL), server  workstation, {{free|Gratis}}, {{site active}}
 Slackware, Patrick Volkerding, dev team, {{date|1993|iso}}, 14.2[62], {{dunno}}, 2016-06-30, {{Proprietary|X}}, Softlanding Linux System (SLS), general, {{free|Gratis}}, {{site active}}
 Slax, Tomas Matejicek, Tomas Matejicek, {{date|2002|iso}}, 9.9.1[63], {{dunno}}, {{date|2019-06-17|iso}}, {{Proprietary|X}}, Debian  Slackware (until Slax 9), live, {{free|Gratis}}, {{site active}}
 SliTaz GNU/Linux, Christophe Lincoln, dev team, {{date|2008|iso}}, Rolling, Rolling, {{date|2017-12-03|iso}}, {{Proprietary|X}}, Independent, portable, {{Free|Gratis}}, {{site active}}
 Solus, Ikey Doherty, dev team, {{date|2005|iso}}, Rolling, Rolling, {{date|2017-08-15|iso}}, {{Proprietary|X}}, –, desktop, {{Free|Gratis}}, {{site active}}
 SolydXK, Arjen Balfoort, dev team, {{date|2013|iso}}, 201902[64], Debian packages as per Debian, {{date|2019-03-03|iso}}, {{Proprietary|X}}, Debian, desktop, {{Free|Gratis}}, {{site active}}
 SparkyLinux, {{dunno}}, Sparky Linux team, {{date|2012|iso}}, 5.7.1[65], {{dunno}}, {{date|2019-04-03|iso}}, {{Proprietary|X}}, Debian, general  video games, {{Free|Gratis}}, {{site active}}
 Source Mage GNU/Linux, Ryan Abrams  Eric Schabell, dev team, {{date|2002|iso}}, 0.62-11, {{dunno}}, {{date|2017-10-22|iso}}, {{Partial|Source Mage Social Contract}}, Sorcerer, general, {{Free|Gratis}}, {{site active}}
 SteamOS, Valve Corporation, Valve Corporation, {{Date|2013|iso}}, 2.190[66], {{dunno}}, {{date|2019-05-14|iso}}, {{Proprietary|X}}, Debian, video games, {{Free|Gratis}}, {{site active}}
 SUSE Linux Enterprise, SUSE, Microfocus, {{date|2000|iso}}, 15SP1, {{dunno}}, 2017-09-07, {{Proprietary|X}}, Slackware  Jurix, workstation  server  supercomputer, {{no|Commercial}}[67], {{site active}}
 Tails, {{dunno}}, Tails Development Team, {{date|2009|iso}}, 3.14.2[68], –[69], 2019-06-23, {{Proprietary|X}}, Debian, security-focused aimed for anonymity 