Protocol, Creator, First public release date, License, Identity (not inc. alias), Asynchronous message relaying, Transport Layer Security, End-to-end encryption, Unlimited number of contacts, Bulletins to all contacts, One-to-many routing 4, Spam protection, Group  channel or conference support, Audio/VoIP support, Webcam/Video, Batch file sharing, Media synchronisation, Serverless 6 (decentralized), Protocol
Bitmessage, Jonathan Warren, 2012 Nov, {{free|Open standard}}, Alphanumeric address, {{Yes}}, {{Yes}}, {{Yes}}, {{Yes}}, {{No}}, {{Yes}}, {{Yes}} (through proof-of-work), {{Yes}}, {{No}}, {{No}}, {{Yes}}, {{No}}, {{Yes}}, Bitmessage
Bonjour, Apple Inc., 2002 August, Proprietary Freeware; portions under the Apache license, Username, {{No}}, {{No}}, {{No}}, {{yes}}, {{No}}, {{Yes|multicast}}, {{partial|Medium}}, {{No}}, {{No}}, {{No}}, {{yes}}, {{No}}, {{yes}}, Bonjour
Briar, Briarproject.org, 2018 May 9, {{free|Open standard}}, Public & Private key (via QR Codes), {{Yes}}, {{Yes}}, {{Yes}}, {{Yes}}, {{Yes}}, {{Yes}}, {{Yes}}, {{Yes}}, {{No}}, {{No}}, {{No}}, {{No}}, {{Yes}}, Briar
Gadu-Gadu, GG Network, 2000 Jul 17, Proprietary, Unique number e.g. 12345678, {{Yes}}, {{Yes}}, {{No}}, {{Yes}}, {{No}}, {{No|Centralistic}}, {{Yes}} 5 (simple), {{Yes}}, {{Yes}}, {{Yes}}, {{Yes}}, {{No}}, {{No}}, Gadu-Gadu
IRC, Jarkko Oikarinen, 1988 Aug, {{free|Open standard}}, Nickname!Username@hostname (or "hostmask") e.g. user!~usr@a.b.com1, {{partial|Yes  but via a memo system that differs from the main system}}, {{partial|Yes  depending on individual server support}}, {{partial|OTR by DM to client-to-client only}}, {{No}}3, {{No}}, {{Yes|Simplistic multicast}}, {{partial|Medium}}, {{Yes}} (everyone  multiple simultaneous  any size), {{No}}, {{No}}, {{Yes}}, {{No}}, {{No}}, IRC
Echo, spot-on.sf.net / goldbug.sf.net, 2013, {{free|Open standard}}, Key, {{Yes}}, {{Yes|Yes  optional}}, {{Yes}}, {{Yes}}, {{Yes}}, {{Yes}}, {{Yes}}, {{Yes}}, {{No}}, {{No}}, {{Yes}}, {{Yes}}, {{Yes}}, Echo
Matrix, Matrix.org, 2014 Sep, {{free|Open standard}}, Matrix user ID (MXID), {{Yes}}, {{Yes|Yes  mandatory}}, {{Optional}}, {{Yes}}, {{No}}, {{Yes}}, {{Yes}} (using pluggable server-side filtering modules), {{Yes}}, {{Yes}}, {{Yes}}, {{Yes}}, {{Yes}}, {{No}}, Matrix
MSNP (Windows Live Messenger  etc.), Microsoft, 1999 Jul, Proprietary, Email address (Microsoft account), {{Yes}}, {{No}}, {{No}}, Only for certified robots, {{No}}, {{No|Centralistic}}, {{Yes}}, {{Yes}}, {{Yes}}, {{Yes}}, {{Yes}}, {{Yes}}, {{No}}, MSNP (Windows Live Messenger  etc.)
MTProto (Telegram), Telegram Messenger LLP, 2013 Aug, {{free|Open standard}}, Phone number (e.g. +1234567890)  nickname (e.g. @example), {{yes}}, {{yes}}, {{Partial|No end-to-end encryption for group chats on any client. No end-to-end encrypted one-on-one chats on desktop clients}}, {{yes}}, {{no}}, {{yes}}, {{yes}}  contact blocking, {{yes}}, {{yes}}[1], {{no}}, {{yes}}, {{yes}}, {{No}}, MTProto (Telegram)
Mumble, Thorvald Natvig, 1999 Jul, {{free|Open standard}}, Username, {{Yes}}, {{Yes}}, {{No}}, Only for certified robots, {{No}}, {{No|Centralistic}}, {{Yes}}, {{Yes}}, {{Yes}}, {{No}}, {{Yes}}, {{No}}, {{No}}, Mumble
OSCAR (AIM  ICQ), AOL, 1997, Proprietary (Discontinued 15-Dec-2017)[2], Username  Email Address or UIN e.g. 12345678, {{Yes}}, {{Yes}} (Aim Pro  Aim Lite), {{No}}, {{No}}, {{No}}, {{No|Centralistic}}, {{No|client-based}}, {{Yes}} (Multiple  simultaneous), {{Yes}}, {{Yes}}, {{Yes}}, {{No}}, {{No}}, OSCAR (AIM  ICQ)
RVP (Windows Messenger  etc.), Microsoft, 1997 Mar, Proprietary (Discontinued), Windows Active Directory Login, {{No}}, {{No}}, {{No}}, {{dunno}}, {{No}}, {{No|Centralistic}}, {{No}}ne, {{No}}, {{dunno}}, {{dunno}}, {{No}}, {{No}}, {{No}}, RVP (Windows Messenger  etc.)
Ricochet, Invisible.im, 2014 Mar, {{free|Open standard}}, Tor onion address, {{Yes}}, {{Yes}}, {{Yes}}, {{Yes}}, {{No}}, {{Yes}}, {{Yes}}, {{Yes}}, {{No}}, {{No}}, {{Yes}}, {{No}}, {{Yes}}, Ricochet
Jami (based on DHT and SIP), Savoir-faire Linux Inc., 2015 May, {{free|Open standard}}, 40-digit address, {{Yes}}, {{Yes}}, {{Yes}}, {{Yes}}, {{No}}, {{Yes}}, {{partial|Medium}}, {{Yes}}, {{Yes}}, {{Yes}}, {{Yes}}, {{No}}, {{Yes}}, Jami (based on DHT and SIP)
Signal Protocol, Signal Messenger, 2014 Feb[3], {{free|Open standard}}, Phone number (e.g. +1234567890), {{yes}}, {{yes}}, {{yes}}, {{yes}}, {{dunno}}, {{yes}}, {{yes}}  contact blocking, {{yes}}, {{yes}}, {{yes}}, {{yes}}, {{yes}}, {{no}}, Signal Protocol
SIP/SIMPLE, IETF, 1996, {{free|Open standard}}, user@hostname, {{Yes}}, {{Yes}}, {{Yes}}, {{Yes}}, {{Yes}}, {{No}}, {{partial|Medium}}, {{dunno}}, {{Yes}}, {{Yes}}, {{Yes}}, {{No}}, Depends on implemenation, SIP/SIMPLE
Skype, Skype, 2003 Aug, Proprietary, Username, {{Yes}}, {{Proprietary}}, {{No}}, {{No}}, {{No}}, {{No|Centralistic}}, {{No|client-based}}, {{Yes}}, {{Yes}}, {{Yes}}, {{Yes}}, {{No}}, {{No}}, Skype
Steam Friends, Valve, 2003 Sep 12, Proprietary, SteamID/Username or Unique Number, {{Yes}}, {{Proprietary}}, {{dunno}}, {{No|No  although rising}}, {{Yes}}, {{dunno}}, {{No}}, {{Yes}}, {{Yes}}, {{No}}, {{No}}, {{No}}, {{No}}, Steam Friends
TOC2, AOL, 2005 Sep, Proprietary (Discontinued), Username or UIN e.g. 12345678, {{Yes}}, {{No}}, {{No}}, {{No}}, {{No}}, {{No|Centralistic}}, {{No}}, paying members only, {{dunno}}, {{dunno}}, {{partial}}, {{dunno}}, {{No}}, TOC2
TOX (based on DHT), irungentoo (github user), 2013 June, {{free|Open standard}}, Public & Private key, {{Yes}}, {{Yes}}, {{Yes}}, {{Yes}}, {{Yes}}, {{dunno}}, {{Yes}}, {{Yes}}, {{Yes}}, {{Yes}}, {{Yes}}, {{dunno}}, {{Yes}}, TOX (based on DHT)
Tuenti, Tuenti, 2006, Proprietary, Username, {{Yes}}, {{Yes}}, {{No}}, {{Yes}}, {{dunno}}, {{Yes}}, {{Yes}}, {{Yes}}, {{Yes}}, {{Yes}}, {{Yes}}, {{dunno}}, {{No}}, Tuenti
Windows Messenger service, Microsoft, 1990, Proprietary (Discontinued), NetBIOS, {{Yes}}, {{No}}, {{No}}, {{Yes}}, {{Yes}}, {{Yes}}, {{No}}, {{No}}, {{No}}, {{No}}, {{No}}, {{No}}, {{No}}, Windows Messenger service
XMPP/Jingle (Google Talk), Jeremie Miller  standardized via IETF, 1999 Jan, {{free|Open standard}}, Jabber ID (JID) e.g. usr@a.b.c/home2, {{Yes}}, {{Yes}}, {{Optional|Optional  multiple implementations}}, {{Yes}}, {{Yes}}[4], {{No|Unicast lists}}[5], {{Optional|Several standardized types}}[6], {{Optional}}, {{Yes}}, {{Yes}}, {{Yes}}, {{yes}}[7], {{Optional}}[8], XMPP/Jingle (Google Talk)
YMSG (Yahoo! Messenger), Yahoo!, 1998  March 9, Proprietary, Username, {{Yes}}, {{No}}{{Update inline|reason=YMSG probably uses TLS based on EFF scorecard from November 2014: https://www.eff.org/node/82654 |?=yes|date=July 2016}}, {{No}}, {{No}}, {{Yes}}, {{No|Centralistic}}, {{Yes}}, {{Yes}}, {{Yes}}, {{Yes}}, {{Yes}}, {{No}}, {{No}}, YMSG (Yahoo! Messenger)
Zephyr Notification Service, MIT, 1987, {{free|Open standard}}, Kerberos principal e.g. user@ATHENA.MIT.EDU, {{Yes}}, {{No}}, {{No}}, {{Yes}}, {{Yes}}, {{Yes}}, {{No}}, {{Yes}}, {{No}}, {{No}}, {{No}}, {{No}}, {{No}}, Zephyr Notification Service
SMS/MMS/EMS/Call, Friedhelm Hillebrand, 1985, Proprietary, Phone number (e.g. +1234567890), {{Yes}}, {{No}}, {{No}}, About 250 contacts in SIM  unlimited from phone., {{No}}, serial messages, {{partial|Medium}}, {{No}}, {{yes}}, {{No}}, {{No}}, {{No}}, {{dunno}}, SMS
Protocol, Creator, First public release date, License, Identity (not inc. alias), Asynchronous message relaying, Transport Layer Security, End-to-end encryption, Unlimited number of contacts, Bulletins to all contacts, One-to-many routing 4, Spam protection, Group  channel or conference support, Audio/VoIP support, Webcam/Video, Batch file sharing, Media synchronisation, Serverless 6 (decentralized), Protocol
