ePub FictionBook CBR/CBZ Kindle File Format Mobipocket PDF Plain text IBA,
Devices Amazon Kindle Barnes & Noble Nook Bookeen Elonex ebook enTourage eDGe Hanlin eReader iPad iriver Story Kobo eReader Onyx Boox Plastic Logic Reader PocketBook eReader Rocket eBook SoftBook Smartphones Tablets Tolino Software Adobe Acrobat Adobe Digital Editions Aldiko Apple Books (iBooks) Aquafadas Blio Bluefire Reader Calibre FBReader Google Play Books Kindle app Kitabu Kobo Lektz Lucifox Okular OverDrive Media Console Snapplify STDU Viewer Sumatra PDF,Amazon Kindle Barnes & Noble Nook Bookeen Elonex ebook enTourage eDGe Hanlin eReader iPad iriver Story Kobo eReader Onyx Boox Plastic Logic Reader PocketBook eReader Rocket eBook SoftBook Smartphones Tablets Tolino,Adobe Acrobat Adobe Digital Editions Aldiko Apple Books (iBooks) Aquafadas Blio Bluefire Reader Calibre FBReader Google Play Books Kindle app Kitabu Kobo Lektz Lucifox Okular OverDrive Media Console Snapplify STDU Viewer Sumatra PDF
Amazon Kindle Barnes & Noble Nook Bookeen Elonex ebook enTourage eDGe Hanlin eReader iPad iriver Story Kobo eReader Onyx Boox Plastic Logic Reader PocketBook eReader Rocket eBook SoftBook Smartphones Tablets Tolino
Adobe Acrobat Adobe Digital Editions Aldiko Apple Books (iBooks) Aquafadas Blio Bluefire Reader Calibre FBReader Google Play Books Kindle app Kitabu Kobo Lektz Lucifox Okular OverDrive Media Console Snapplify STDU Viewer Sumatra PDF
ABBYY FineReader AbiWord Adobe InDesign Adobe RoboHelp Aquafadas Atlantis Word Processor Booktype Calibre Calligra Author eXeLearning Help & Manual HelpNDoc iBooks Author iStudio Publisher LaTeX LibreOffice MadCap Flare Oxygen XML Editor PagePlus Pages QuarkXPress Scrivener Sigil Writer2epub
Commercial Amazon Kindle Store Baen Free Library Barnes & Noble Booktrack Feedbooks Google Play iBooks Store Jarir.com Kobo Bookstore Sony Reader Store Smashwords Noncommercial Faded Page HathiTrust Internet Archive Project Gutenberg Australia Canada Wikisource,Amazon Kindle Store Baen Free Library Barnes & Noble Booktrack Feedbooks Google Play iBooks Store Jarir.com Kobo Bookstore Sony Reader Store Smashwords,Faded Page HathiTrust Internet Archive Project Gutenberg Australia Canada Wikisource
Amazon Kindle Store Baen Free Library Barnes & Noble Booktrack Feedbooks Google Play iBooks Store Jarir.com Kobo Bookstore Sony Reader Store Smashwords
Faded Page HathiTrust Internet Archive Project Gutenberg Australia Canada Wikisource
Academic journal publishing reform Braille e-book Comparison of e-book readers Comparison of iOS e-book reader software Comparison of Android e-book reader software E-book lending Electronic publishing iBooks Author Conference International Digital Publishing Forum Kindle single OPDS Reflowable document Semantic publishing
